item,name,description,type,category,subcategory,text,label
http://www.wikidata.org/entity/Q140676,rediff.com,Indian news and entertainment website,named entity,media,media company,"Rediff.com, stylized as rediff.com, is an Indian news, information, entertainment, and shopping website. Founded by Ajit Balakrishnan in 1996, it was the first Indian website to become a mainstream news media organization. It is headquartered in Mumbai with offices in Bangalore, New Delhi, and New York City.
As of 2009, it had more than 300 employees. At the time of its founding, internet access had only been available in India for five months with a mere 18,000 users, leaving Rediff.com as one of the earliest Indian web portals and email providers.
Rediff has there main businesses as News, Moneywizz, Portfolio, Rediff Gurus and Mail


== History ==
The Rediff.com domain was registered in India in 1996. Early products included the email service Rediffmail and Rediff Shopping, an online marketplace selling electronics and peripherals.
In 2001, Rediff.com was alleged to be in violation of the Securities Act of 1933 for filing a materially false prospectus in relation to an IPO of its Ame",cultural agnostic
http://www.wikidata.org/entity/Q1297719,French moralist,philosopher or theologian who works in moralism or morality,named entity,philosophy and religion,philosopher,"In French literature, the moralists (French: moralistes) were a tradition of secular writers who described ""personal, social and political conduct"", typically through maxims. The tradition is associated with the salons of the Ancien Régime from the 16th through the 18th centuries. The tradition begins with the Essais of Michel de Montaigne (1580), but its heyday was the late 17th century.
Although the moralists wrote essays and pen-portraits, their preferred genre was the maxim. These were short abstract statements devoid of context, often containing paradoxes and always designed to shock or surprise. The moralists aimed for objective and impartial observation freed from the preconceptions of their day. Their approach was never systematic. The four principal moralists and their main works are:

François de La Rochefoucauld, Réflexions ou sentences et maximes morales (1665)
Jean de La Bruyère, Caractères ou les moeurs de ce siècle (1688)
Luc de Clapiers, marquis de Vauvenargues, Introdu",cultural exclusive
http://www.wikidata.org/entity/Q53121,cycling,"riding a bicycle (transportation, sport, exercise, recreation...)",concept,transportation,mode of transport,"Cycling, also known as bicycling or biking, is the activity of riding a bicycle or other types of pedal-driven human-powered vehicles such as balance bikes, unicycles, tricycles, and quadricycles. Cycling is practised around the world for purposes including transport, recreation, exercise, and competitive sport.


== History ==

Cycling became popularized in Europe and North America in the latter part and especially the last decade of the 19th century. Today, over 50 percent of the human population knows how to ride a bike.


=== War ===

The bicycle has been used as a method of reconnaissance as well as transporting soldiers and supplies to combat zones. In this it has taken over many of the functions of horses in warfare. In the Second Boer War, both sides used bicycles for scouting. In World War I, France, Germany, Australia and New Zealand used bicycles to move troops. In its 1937 invasion of China, Japan employed some 50,000 bicycle troops, and similar forces were instrumental in ",cultural agnostic
http://www.wikidata.org/entity/Q507220,DARPA Grand Challenge,prize competition for American autonomous vehicles,named entity,sports,recurring sporting event,"The DARPA Grand Challenge is a prize competition for American autonomous vehicles, funded by the Defense Advanced Research Projects Agency, the most prominent research organization of the United States Department of Defense. Congress has authorized DARPA to award cash prizes to further DARPA's mission to sponsor revolutionary, high-payoff research that bridges the gap between fundamental discoveries and military use. The initial DARPA Grand Challenge in 2004 was created to spur the development of technologies needed to create the first fully autonomous ground vehicles capable of completing a substantial off-road course within a limited time. The third event, the DARPA Urban Challenge in 2007, extended the initial Challenge to autonomous operation in a mock urban environment.  The 2012 DARPA Robotics Challenge, focused on autonomous emergency-maintenance robots, and new Challenges are still being conceived.  The DARPA Subterranean Challenge was tasked with building robotic teams to auto",cultural agnostic
http://www.wikidata.org/entity/Q840584,Scouting for Boys,book,named entity,Books,book,"Scouting for Boys: A handbook for instruction in good citizenship is a book on Boy Scout training, published in various editions since 1908. Early editions were written and illustrated by Robert Baden-Powell with later editions being extensively rewritten by others. The book was originally a manual for self-instruction in observation, tracking and woodcraft skills as well as  self-discipline and self-improvement, about the British Empire and duty as citizens with an eclectic mix of anecdotes and unabashed personal observations and recollections. It is pervaded by a degree of moral proselytizing and references to the author's own exploits. It is based on his boyhood experiences, his experience with the Mafeking Cadet Corps during the Second Boer War at the siege of Mafeking, and on his experimental camp on Brownsea Island, England.


== History ==
Scouting for Boys (1908) was Baden-Powell's rewrite of his earlier book Aids to Scouting (1899) with many youth training ideas openly taken f",cultural exclusive
http://www.wikidata.org/entity/Q847906,online magazine,"website-based magazine (different from E-zine, which is sent to the subscribers)",concept,media,magazine,"An online magazine is a magazine published on the Internet, through bulletin board systems and other forms of public computer networks. One of the first magazines to convert from a print magazine format to an online only magazine was the computer magazine Datamation. Some online magazines distributed through the World Wide Web call themselves webzines. An ezine (also spelled e-zine) is a more specialized term appropriately used for small magazines and newsletters distributed by any electronic method, for example, by email. 
Some social groups may use the terms cyberzine and hyperzine when referring to electronically distributed resources. Similarly, some online magazines may refer to themselves as ""electronic magazines"", ""digital magazines"", or ""e-magazines"" to reflect their readership demographics or to capture alternative terms and spellings in online searches. An online magazine shares some features with a blog and also with online newspapers, but can usually be distinguished by its",cultural agnostic
http://www.wikidata.org/entity/Q178743,stele,stone or wooden slab erected for funerals or commemorative purposes,concept,History,monument,"A stele ( STEE-lee) or stela ( STEE-lə) is a stone or wooden slab, generally taller than it is wide, erected in the ancient world as a monument. The surface of the stele often has text, ornamentation, or both. These may be inscribed, carved in relief, or painted.
Stelae were created for many reasons. Grave stelae were used for funerary or commemorative purposes. Stelae as slabs of stone would also be used as ancient Greek and Roman government notices or as boundary markers to mark borders or property lines. Stelae were occasionally erected as memorials to battles. For example, along with other memorials, there are more than half-a-dozen steles erected on the battlefield of Waterloo at the locations of notable actions by participants in battle.
A traditional Western gravestone (headstone, tombstone, gravestone, or marker) may technically be considered the modern equivalent of ancient stelae, though the term is very rarely applied in this way. Equally, stele-like forms in non-Western cul",cultural agnostic
http://www.wikidata.org/entity/Q205543,American Football League All-Time Team,Official list of the American Football League's best players,named entity,sports,sports team,"The American Football League (AFL) All-Time Team was selected on January 14, 1970. The first and second teams were determined by a panel of members of the AFL's Hall of Fame Board of Selectors:


== Offense ==


== Defense ==


== Special teams ==


== Coach ==


== See also ==
List of American Football League players


== Notes ==


== References ==",cultural representative
http://www.wikidata.org/entity/Q334451,language policy,legal measures regarding the use of language,concept,politics,policy,"Language policy is both an interdisciplinary academic field and implementation of ideas about language use.
Some scholars such as Joshua Fishman and Ofelia García consider it as part of sociolinguistics. On the other hand, other scholars such as Bernard Spolsky, Robert B. Kaplan and Joseph Lo Bianco argue that language policy is a branch of applied linguistics.
As a field, language policy is also known as language planning or language policy and planning, and is related to other fields such as language ideology, language revitalization, and language education, among others.


== Definitions ==
Language policy has been defined in a number of ways. According to Kaplan and Baldauf (1997), ""A language policy is a body of ideas, laws, regulations, rules and practices intended to achieve the planned language change in the societies, group or system"" (p. xi). 
Lo Bianco defines the field as ""a situated activity, whose specific history and local circumstances influence what is regarded as a la",cultural agnostic
http://www.wikidata.org/entity/Q43459,Ferdowsi,"Persian poet, author of Shahnameh",named entity,Literature,poet,"Abu'l-Qâsem Ferdowsi Tusi (also Firdawsi, Persian: ابوالقاسم فردوسی توسی; 940 – 1019/1025) was a Persian poet and the author of Shahnameh (""Book of Kings""), which is one of the world's longest epic poems created by a single poet, and the greatest epic of Persian-speaking countries. Ferdowsi is celebrated as one of the most influential figures of Persian literature and one of the greatest in the history of literature.


== Name ==
Except for his kunya (ابوالقاسم – Abul-Qâsem, meaning 'father of Qasem') and his pen name (فِردَوسی – Ferdowsī, meaning 'paradisic'), nothing is known with any certainty about his full name. According to Djalal Khaleghi-Motlagh, the information given by the 13th-century author Bundari about Ferdowsi's name should be taken as the most reliable. Bundari calls the poet al-Amir al-Hakim Abu'l-Qasem Mansur ibn al-Hasan al-Ferdowsi al-Tusi. From an early period on, he has been referred to by different additional names and titles, the most common one being حکیم / Hak",cultural representative
http://www.wikidata.org/entity/Q1280834,Bible society,"non-profit organization, usually ecumenical in makeup, devoted to translating, publishing, and distributing the Bible",named entity,Literature,publisher,"A Bible society is a non-profit organization, usually nondenominational in makeup, devoted to translating, publishing, and distributing the Bible at affordable prices.  In recent years they also are increasingly involved in advocating its credibility and trustworthiness in contemporary cultural life.  Traditionally Bible society editions contain scripture, without any doctrinal notes or comments, although they may include non-sectarian notes on alternate translations of words, or variations in the different available manuscripts.


== History of Bible production ==
The production and distribution of bibles are issues that have engaged the attention of Christian leaders for centuries. In an extant letter, dated 331, Emperor Constantine requested Eusebius, bishop of Caesarea, to provide him with fifty copies of the Old and New Testaments for use in the principal churches in Constantinople. In 797, Charlemagne commissioned Alcuin to prepare an emended text of the Vulgate; multiple copies ",cultural agnostic
http://www.wikidata.org/entity/Q59281,transitional government,temporary or emergency government body/authority created when none exists,named entity,politics,government,"A provisional government, also called an interim government, an emergency government, a transitional government or provisional leadership, is a temporary government formed to manage a period of transition, often following state collapse, revolution, civil war, or some combination thereof.
Provisional governments generally come to power in connection with a grave crisis that has caused the previous government to suddenly and irreversibly collapse, such as economic collapse, civil war, defeat in a foreign war, revolution, or the death of a long-serving authoritarian ruler. Questions of democratic transition and state-building are often fundamental to the formation and policies of such governments.
Provisional governments maintain power until a new government can be appointed by a regular political process, which is generally an election. They may be involved with defining the legal structure of subsequent regimes, guidelines related to human rights and political freedoms, the structure o",cultural agnostic
http://www.wikidata.org/entity/Q1192,Jean-Baptiste Lully,Italian-born French composer (1632–1687),named entity,Performing arts,choreographer,"Jean-Baptiste Lully (28 or 29 November [O.S. 18 or 19 November] 1632 – 22 March 1687) was a French composer, dancer and instrumentalist of Italian birth, who is considered a master of the French Baroque music style. Best known for his operas, he spent most of his life working in the court of Louis XIV of France and became a French subject in 1661. He was a close friend of the playwright Molière, with whom he collaborated on numerous comédie-ballets, including L'Amour médecin, George Dandin ou le Mari confondu, Monsieur de Pourceaugnac, Psyché and his best known work, Le Bourgeois gentilhomme.


== Biography ==

Lully was born on November 28 or 29, 1632, in Florence, Grand Duchy of Tuscany, to Lorenzo Lulli and Caterina Del Sera, a Tuscan family of millers. His general education and his musical training during his youth in Florence remain uncertain, but his adult handwriting suggests that he manipulated a quill pen with ease. He used to say that a Franciscan friar gave him his first mus",cultural representative
http://www.wikidata.org/entity/Q188116,Fourteenth Amendment to the United States Constitution,"1868 amendment addressing citizenship rights, civil and political liberties",named entity,politics,law,"The Fourteenth Amendment (Amendment XIV) to the United States Constitution was adopted on July 9, 1868, as one of the Reconstruction Amendments. Considered one of the most consequential amendments, it addresses citizenship rights and equal protection under the law at all levels of government. The Fourteenth Amendment was a response to issues affecting freed slaves following the American Civil War, and its passage was bitterly contested. States of the defeated Confederacy were required to ratify it to regain representation in Congress. The amendment, particularly its first section, is one of the most litigated parts of the Constitution, forming the basis for landmark Supreme Court decisions, such as Brown v. Board of Education (1954; prohibiting racial segregation in public schools), Loving v. Virginia (1967; ending interracial marriage bans), Roe v. Wade (1973; recognizing federal right to abortion until overturned in 2022), Bush v. Gore (2000; settling 2000 presidential election), Obe",cultural representative
http://www.wikidata.org/entity/Q6784637,Massie Wireless Station,"historic wireless telegraphy station in Rhode Island, USA",named entity,architecture,construction,"The Massie Wireless Station (PJ) was built in Point Judith, Rhode Island, in 1907 and may be the oldest surviving working wireless station in the world. It is named for inventor Walter Wentworth Massie, president of the Massie Wireless Telegraph Company. The structure was moved to the New England Wireless and Steam Museum in 1983 where it is preserved as a technology museum and historic site.


== History ==

In December 1902 the American De Forest Wireless Telegraph Company set up an earlier station in an existing house on a beach near Point Judith Light and another near Block Island Southeast Light, 15 miles (24 km) from the coast. By May 1903 they had successfully exchanged test messages. Messages were sent using Morse code. The stations were initially operated for the Providence Journal to send news stories to the island to be printed locally. Another goal was that passing ships could also send messages to the mainland which would then be relayed to Providence or New York City by t",cultural exclusive
http://www.wikidata.org/entity/Q2519376,jewelry designer,one who creates jewelry or designs for its manufacture,concept,Fashion,designer,"Jewellery design is the art or profession of designing and creating jewellery. It is one of civilization's earliest forms of decoration, dating back at least 7,000 years to the oldest-known human societies in Indus Valley Civilization, Mesopotamia, and Egypt. The art has taken many forms throughout the centuries, from the simple beadwork of ancient times to the sophisticated metalworking and gem-cutting known in the modern day.
Before an article of jewellery is created, design concepts are rendered followed by detailed technical drawings generated by a jewellery designer, a professional who is trained in the architectural and functional knowledge of materials, fabrication techniques, composition, wearability, and market trends.
Traditional hand-drawing and drafting methods are still utilized in designing jewellery, particularly at the conceptual stage. However, a shift is taking place to computer-aided design programs. Whereas the traditionally hand-illustrated jewel is typically trans",cultural agnostic
http://www.wikidata.org/entity/Q66626,Hornussen,"village and former municipality in Böztal in the canton of Aargau, Switzerland",named entity,Geography,neighborhood,"Hornussen is a former municipality in the district of Laufenburg in the canton of Aargau in Switzerland. On 1 January 2022 the former municipalities of Bözen, Effingen, Elfingen and Hornussen merged into the new municipality of Böztal.


== History ==
Scattered archeological discoveries indicate that the land that would become Hornussen was lightly occupied during the Stone Age.  During the Roman era, it was located on the important route over the Bözberg.  However, the first mention of Hornussen is in 1281 as Hornescon. Until the 1802 Act of Mediation, all manor rights to the village were held by collegiate church of Säckingen.  Until 1797 it was part of the Austrian-Habsburg Rheinfelden District.  Since 1803 Hornussen has belong to the Canton of Aargau.  Starting in the 15th century, the Manor of Hornussen had a formal special status within the Habsburg territory.  The lord of the manor was the court of appeals for all of Säckingen and also the economic center of the district.  This ",cultural exclusive
http://www.wikidata.org/entity/Q665982,Posca,Ancient Roman drink,concept,food,drink,"Posca was an ancient Roman drink made by mixing water and wine vinegar. Bracing but less nutritious and generally less palatable than wine, it was typically a drink for soldiers, the lower classes, and slaves.


== Etymology and later elaborations ==
The word posca is derived from either Latin potor 'to drink' or from Greek epoxos 'very sharp'. Because the Greeks lacked a word for posca, sources written in Greek, such as the Gospels and Plutarch, use the word οξος, oxos 'vinegar' in its place (translated as acetum in the Vulgate Bible). The word eventually migrated into Greek from about the sixth century AD onward as the Byzantine army continued the Roman tradition, drinking what they termed phouska. This word (sometimes rendered phouska) may mean 'beer' in some contexts:

What it certainly meant originally, like Latin posca, was vinegar-and-water, the regular beverage of the classical Roman army on bad days. Thus Aëtius gives, and Paul of Aegina repeats, a recipe for a ""palatable and ",cultural exclusive
http://www.wikidata.org/entity/Q546264,beat music,"popular music genre, influenced by rock and roll, skiffle, traditional pop music; developed in the UK early 1960s",concept,Music,music genre,"Beat music, British beat, or Merseybeat is a British popular music genre that developed around Liverpool in the late 1950s and early 1960s. The genre melded influences from British and American rock and roll, rhythm and blues, skiffle, traditional pop, and music hall. It rose to mainstream popularity in the United Kingdom and Europe by 1963 before spreading to North America in 1964 with the British Invasion. The beat style shaped popular music and youth culture through 1960s movements such as garage rock, folk rock and psychedelic music.


== Origin ==
The exact origins of the terms 'beat music' and 'Merseybeat' are uncertain. ""Beat"" alludes to the driving rhythms adopted from rock and roll, R&B, and soul music—not the Beat Generation literary movement of the 1950s. As the initial wave of rock and roll subsided in the later 1950s, ""big beat"" music, later shortened to ""beat"", became a live dance alternative to the balladeers like Tommy Steele, Marty Wilde, and Cliff Richard who were dom",cultural representative
http://www.wikidata.org/entity/Q495488,forage fish,small fish which are preyed on by larger predators for food,concept,Biology,fish,"Forage fish, also called prey fish or bait fish, are small pelagic fish that feed on planktons (i.e. planktivores) and other small aquatic organisms (e.g. krill). They are in turn preyed upon by various predators including larger fish, seabirds and marine mammals, this making them keystone species in their aquatic ecosystems.
The typical ocean forage fish feed at the lower trophic level of the food chain, often by filter feeding. They include particularly fishes of the order Clupeiformes (herrings, sardines, shad, hilsa, menhaden, anchovies, and sprats), but also other small fish, including halfbeaks, silversides, smelt such as capelin and goldband fusiliers.
Forage fish compensate for their small size by forming schools. Some swim in synchronised grids with their mouths open so they can efficiently filter plankton. These schools can become immense shoals which move along coastlines and migrate across open oceans. The shoals are concentrated energy resources for the great marine predat",cultural agnostic
http://www.wikidata.org/entity/Q544972,trombonist,musician who plays the trombone,concept,Music,musical profession,"The trombone (German: Posaune, Italian, French: trombone) is a musical instrument in the brass family. As with all brass instruments, sound is produced when the player's lips vibrate inside a mouthpiece, causing the air column inside the instrument to vibrate. Nearly all trombones use a telescoping slide mechanism to alter the pitch instead of the valves used by other brass instruments. The valve trombone is an exception, using three valves similar to those on a trumpet, and the superbone has valves and a slide.
The word ""trombone"" derives from Italian tromba (trumpet) and -one (a suffix meaning ""large""), so the name means ""large trumpet"". The trombone has a predominantly cylindrical bore like the trumpet, in contrast to the more conical brass instruments like the cornet, the flugelhorn, the baritone, and the euphonium. The most frequently encountered trombones are the tenor trombone and bass trombone. These are treated as non-transposing instruments, reading at concert pitch in bass c",cultural agnostic
http://www.wikidata.org/entity/Q693791,koto,traditional dress of women in Suriname,concept,Fashion,traditional costume,"The koto is a traditional dress from the Afro-Surinamese or Creole women in Suriname. Women who wear the dress are called kotomisi (misi means miss in Sranan Tongo).
Different kotos exist for various occasions like weddings or funerals.  The development of the koto as regular dress is not complete but it is still used in special occasions like the koto-dansi.
With the koto, women wear a head or body covering called an angisa or anisa. The folding of the angisa sends a social message, for example “Let them talk.”
For men the traditional clothing is the pangani. 


== Gallery ==

		
			
			
		
		
			
			
		
		
			
			
		
		
			
			
		
		
			
			
		


== References ==


== External links ==

Examples of traditional kotos
Examples of koto's currently used, traditional and modern
Examples of the angisa and the social message",cultural exclusive
